{
  "registry_version": "1.0.0",
  "authority": "CAPABILITY_FUNCTIONAL_AUTHORITY",
  "routing_consumer": "config/capability_routing.yaml",
  "compatibility_tokens": {
    "maturity": {"DEFINED": "DEFINED", "REGISTERED": "REGISTERED", "IMPLEMENTED": "IMPLEMENTED", "DEMONSTRATED": "DEMONSTRATED", "AGENT_TESTED_IN_ISOLATION": "IMPLEMENTED"},
    "availability": {"NON_EXECUTABLE": "NON_EXECUTABLE_CURRENT", "IMPLEMENTED_NOT_DEMONSTRATED": "UNMAPPED_IMPLEMENTED_NOT_DEMONSTRATED", "ACTIVE": "ACTIVE", "BLOCKED": "SUSPENDED", "DEFERRED": "NON_EXECUTABLE_CURRENT"},
    "assurance": {"PASS": "PASS", "FAIL": "FAIL", "NOT_TESTED": "NOT_TESTED", "UNAVAILABLE": "UNAVAILABLE"},
    "approval": {"APPROVED": "APPROVED", "PENDING": "PENDING", "REJECTED": "REJECTED", "NOT_APPROVED": "PENDING"},
    "evidence": {"PRESENT": "PRESENT", "MISSING": "MISSING", "NOT_TESTED": "NOT_TESTED"}
  },
  "capabilities": [
    {
      "functional_authority_domain": "SCRIPT_PRODUCT",
      "functional_requirements": ["RESEARCH_V2_B2_M4_M5_M6_REAL_PATH"],
      "implementation_kind": "SEMANTIC",
      "implementation_refs": ["src/application/research_m7.py", "src/application/research_b2.py", "src/application/research_b3.py", "src/application/research_b4.py", "src/ai/execution.py"],
      "contract_refs": ["schemas/research_plan_proposal.json", "schemas/research_source_access.json", "schemas/source_access_and_evidence_report.json", "schemas/research_plan.json", "schemas/research_pack.json", "schemas/independent_research_audit.json", "schemas/research_ready_manifest.json"],
      "assigned_role": ["RESEARCH_AND_CURATION", "INDEPENDENT_RESEARCH_AUDITOR"],
      "prompt_reference": ["prompt_research_curation"],
      "execution_profile_refs": ["config/agent_execution_profiles.json"],
      "routing_ref": "config/capability_routing.yaml",
      "input_contract": "RESEARCH_V2_REAL_INPUT",
      "output_contract": "schemas/research_ready_manifest.json",
      "capability_id": "EXTEND_01_RESEARCH_V2_REAL_E2E",
      "domain": "SCRIPT_PRODUCT",
      "purpose": "Preparar la ruta B2→M4→M5→M6 de Research V2 para una ejecución REAL posterior bajo autorización explícita.",
      "maturity_status": "IMPLEMENTED",
      "availability_status": "READY_NOT_AUTHORIZED",
      "routing_required": true,
      "dependencies": ["config/execution_provenance_policy.json", "config/agent_execution_profiles.json"],
      "schema_reference": ["research_plan", "research_pack", "independent_research_audit", "research_ready_manifest"],
      "assurance": {"technical": "NOT_TESTED", "semantic": "NOT_TESTED", "functional_approval": "PENDING", "operational_evidence": "MISSING"},
      "executability_evidence": {
        "contracts_resolvable": true,
        "implementation_present": true,
        "dependencies_satisfied": true,
        "context_resolvable": true,
        "roles_resolvable": true,
        "prompts_resolvable": true,
        "execution_profiles_resolvable": true,
        "routing_resolvable": true,
        "real_b2_input_binding_available": true,
        "real_stage_adapters_bound": true,
        "real_entrypoint_operational": false
      }
    },
    {
      "functional_authority_domain": "SCRIPT_PRODUCT",
      "functional_requirements": ["B4_INDEPENDENT_RESEARCH_AUDIT_CONTRACT"],
      "implementation_kind": "SEMANTIC",
      "implementation_refs": ["src/application/research_b4.py", "src/ai/execution.py"],
      "contract_refs": ["schemas/independent_research_audit.json", "schemas/research_ready_manifest.json"],
      "assigned_role": ["INDEPENDENT_RESEARCH_AUDITOR"],
      "prompt_reference": ["prompt_research_curation"],
      "execution_profile_refs": ["config/agent_execution_profiles.json"],
      "routing_ref": "config/capability_routing.yaml",
      "input_contract": "M6_RESEARCH_CHAIN",
      "output_contract": "schemas/independent_research_audit.json",
      "capability_id": "PLAN012_M6_INDEPENDENT_RESEARCH_AUDIT",
      "domain": "SCRIPT_PRODUCT",
      "purpose": "Ejecutar la auditoría sintética independiente de la cadena de investigación M6 y producir sus bindings técnicos.",
      "maturity_status": "DEMONSTRATED",
      "availability_status": "ACTIVE",
      "routing_required": true,
      "dependencies": ["config/execution_provenance_policy.json", "schemas/independent_research_audit.json"],
      "schema_reference": ["independent_research_audit", "research_ready_manifest"],
      "evidence_refs": ["tests/core/test_plan012_m6_b4_research_ready.py"],
      "execution_evidence_refs": ["tests/core/test_plan012_m6_b4_research_ready.py"],
      "executability_evidence": {
        "contracts_resolvable": true,
        "implementation_present": true,
        "dependencies_satisfied": true,
        "context_resolvable": true,
        "roles_resolvable": true,
        "prompts_resolvable": true,
        "execution_profiles_resolvable": true,
        "routing_resolvable": true
      }
    },
    {
      "functional_authority_domain": "CHANNEL_INTELLIGENCE",
      "functional_requirements": ["CAPABILITY_SCOPE_DECLARED"],
      "implementation_kind": "SEMANTIC",
       "implementation_refs": ["src/application/topic_belonging.py", "src/scripts/channel_intelligence.py", "src/scripts/topic_belonging_flow.py"],
       "contract_refs": ["schemas/topic_belonging_input.json", "schemas/topic_belonging_cognitive_proposal.json", "schemas/topic_belonging_cognitive_assessment.json", "schemas/topic_belonging_cognitive_decision.json", "schemas/topic_belonging_assessment.json", "schemas/topic_belonging_decision.json", "schemas/external_result_envelope.json"],
      "profile_refs": ["config/active_editorial_profile.json", "config/editorial_profile_registry.json"],
      "execution_profile_refs": ["config/agent_execution_profiles.json"],
      "routing_ref": "config/capability_routing.yaml",
      "routing_required": true,
       "assurance": {"technical": "PASS", "semantic": "PASS", "functional_approval": "PENDING", "operational_evidence": "PRESENT"},
      "executability_evidence": {"contracts_resolvable": true, "implementation_present": true, "roles_resolvable": true, "prompts_resolvable": true, "execution_profiles_resolvable": true, "routing_resolvable": true, "context_resolvable": true, "dependencies_satisfied": true},
       "evidence_refs": ["tests/harness/test_plan009_m1_vertical.py"],
      "capability_id": "TOPIC_BELONGING_ASSESSMENT",
      "domain": "CHANNEL_INTELLIGENCE",
      "purpose": "Evaluar y decidir si una propuesta temática pertenece al canal antes de desarrollar un episodio real.",
      "assigned_role": [
        "CHANNEL_INTELLIGENCE_PRODUCER",
        "CHANNEL_INTELLIGENCE_REVIEWER"
      ],
      "input_contract": "schemas/topic_belonging_input.json",
      "output_contract": "schemas/topic_belonging_decision.json",
      "decision_authority": "CHANNEL_INTELLIGENCE_REVIEWER_FOR_ORDINARY_TOPICS",
      "veto_authority": "CHANNEL_INTELLIGENCE_REVIEWER_WITHIN_CHANNEL_SCOPE",
      "owner_escalation_conditions": [
        "experimental territory",
        "positioning expansion",
        "sensitive partisan matter",
        "audience change",
        "exclusion reinterpretation",
        "new personal exposure",
        "voice or authorial persona change",
        "precedent risk"
      ],
       "maturity_status": "IMPLEMENTED",
       "availability_status": "READY_NOT_AUTHORIZED",
      "material_decision_ref": {
        "registry_path": "docs/legacy/material_decision_registry.json",
        "decision_id": "MD-CI-001",
        "subject_ref": "capability:TOPIC_BELONGING_ASSESSMENT"
      },
      "dependencies": [
        "config/active_editorial_profile.json",
        "config/editorial_profile_registry.json",
        "profiles/voice/corpus_manifest.json",
        "policies/channel_intelligence/topic_belonging_policy.md",
        "schemas/topic_belonging_owner_decision.json"
      ],
      "prompt_reference": [
        "prompt_channel_intelligence_producer",
        "prompt_channel_intelligence_reviewer"
      ],
      "schema_reference": [
        "topic_belonging_input",
        "topic_belonging_assessment",
        "topic_belonging_decision",
        "topic_belonging_owner_decision"
      ],
      "activation_rule": "ACTIVE_ONLY_AFTER_R6_B_AUTHORIZED_CONTROLLED_DEMONSTRATIONS_FUNCTIONAL_AUDIT_AND_OWNER_ACTIVATION"
    },
    {
      "functional_authority_domain": "SCRIPT_PRODUCT",
      "functional_requirements": ["B5_I2_SEMANTIC_AUDIT_CONTRACT"],
      "implementation_kind": "SEMANTIC",
      "implementation_refs": ["src/scripts/run_b5_i2_semantic_audit.py"],
      "contract_refs": ["schemas/b5_i2_semantic_sufficiency_audit.json"],
      "profile_refs": ["config/active_editorial_profile.json", "config/editorial_profile_registry.json"],
      "execution_profile_refs": ["config/agent_execution_profiles.json"],
      "routing_ref": "config/capability_routing.yaml",
      "routing_required": true,
      "assurance": {"technical": "NOT_TESTED", "semantic": "NOT_TESTED", "functional_approval": "PENDING", "operational_evidence": "NOT_TESTED"},
      "executability_evidence": {"contracts_resolvable": true, "implementation_present": true, "roles_resolvable": true, "prompts_resolvable": true, "execution_profiles_resolvable": true, "routing_resolvable": true, "context_resolvable": true, "dependencies_satisfied": true},
      "evidence_refs": [],
      "capability_id": "B5_I2_SEMANTIC_AUDITOR",
      "domain": "SCRIPT_PRODUCT",
      "purpose": "Auditar de forma independiente los artefactos B5-I2 sin modificarlos ni autorizar B5-I3, aprobacion funcional o ejecucion real.",
      "assigned_role": ["SCRIPT_PRODUCT_AUDITOR"],
      "input_contract": "B5_I2_AUDIT_ARTIFACT_SET",
      "output_contract": "schemas/b5_i2_semantic_sufficiency_audit.json",
      "decision_authority": "SCRIPT_PRODUCT_AUDITOR_SEMANTIC_AUDIT_ONLY",
      "veto_authority": "SCRIPT_PRODUCT_AUDITOR_ON_INSUFFICIENT_EVIDENCE_OR_INDEPENDENCE",